{
  "id": "synora.intelligence",
  "version": "0.1.0",
  "description": "Topology and resident configuration plus cognitive processing. Cognitive Core owns orchestration; the intelligence/mlp package owns the CPU bundle inference adapters over Core contracts.",
  "domain": "intelligence",
  "required_capabilities": [
    "synora.contracts/v1",
    "synora.state-store/v1"
  ],
  "optional_capabilities": [],
  "required_dependencies": [
    "synora.foundation"
  ],
  "optional_dependencies": [],
  "provided_interfaces": [
    "synora.intelligence.topology/v1"
  ],
  "consumed_interfaces": [
    "synora.contracts/v1",
    "synora.state-store/v1"
  ],
  "configuration_schema": null,
  "state_ownership": [
    "topology and resident configuration",
    "cognitive processing and snapshot projection algorithms"
  ],
  "resource_requirements": [
    "CPU",
    "configured local topology data"
  ],
  "maturity": "partial",
  "source_packages": [
    "internal/intelligence/topology",
    "internal/intelligence/mlp",
    "internal/cognitivecore"
  ]
}
